,username,Gender,Education,Ethnicity,about_me_text
222,sweetlksugar,F,Some college,Hispanic,"Homebody. Watch a lot of shows and movies, listen to country & 90’s alt/r&b/hip-hop, and sleep whenever I get a chance. I have a gym membership but I spend more time in my bed than the gym. I need some motivation, maybe avoiding having to shop the next size up, maybe a cute guy to go hiking with and inspire me? Mother to a wonderful preteen monster who is arguably probably smarter than most of you reading this. But don’t let her brains intimidate you, she’s a sucker for dogs and food and luckily doesn’t meet men I date so you only have me to impress."
223,5Dallamakeyahalla,F,High school,Hispanic,"I'm 52 years old woman born and raised in Austin Texas and I am looking for a man who is honest, hard-working and who knows how to treat a woman with respect, make her feel loved and wanted and appreciated I'm not looking for cheaters, Liars and dishonest man.I like all kinds of music. I love to dance especially to Tejano music. I like to go out to Dinner and a Movie or go out Dancing.send a message if you want to meet. I don't have that meet me feature."
224,ATXgirl322,F,Some college,Caucasian,"I am an ambitious, self-motivated, career focused mother of two. Summer is my favorite time of year. I love being poolside or on the Lake with friends. Grilling out by the pool is another favorite of mine. I'm loyal to a fault and a caregiver by heart.I'm very social and it's hard for me to slow down. Love adventure and always willing to try new things.I will keep it real 100% of the time and can be bit sarcastic at times.If you do not have your face in your picture I will not respond."
225,persianna,F,Bachelors Degree,Hispanic,"PASS IF YOU WANT A**! Lol Love working out. Love music. Love to laugh. Honesty and strong communication are key for me. Can you focus on me? This is ADHD dating. Patience is a virtue. Time is valuable. Invest your all for what you want! Must be empathetic, honest, and a great communicator. If you can’t talk on the phone and are inconsistent in communication, we are not for each other. "
226,Margaritadrink,F,Bachelors Degree,Hispanic,"I love life and laughter, I like having fun, dancing, swimming, movies, lake and doing things at the spur of the moment. Whoever I meet, have to believe in God and he has to be important in their lives too.If you ready to get going on with this life...send me a message...life is to short to be doing nothing..!"
227,dgarza24,F,High school,Mixed Race,"Hi! i like to have fun i love to swim, read , movies. Crochet , camping, fishing and hunting.I like every kind of music but country is my favorite.I would like to trivial more take a road trip and see the world.Ask for a pic "
228,1cyndi,F,Associates Degree,Caucasian,"Hello. I’m new to Georgetown but born and raised in Texas. I’ve been a nurse for over 35 years. Have successfully raised 5 children and now am a proud Mimi of 5 wonderful Grands! I’ve focused most of my adult life on my career and raising my children and am ready to focus on my personal life and meet new people and hopefully find the person I can’t live without! I enjoy going to the beach, lake, ocean, river. Enjoy nice walks and moderate exercise. I like to read but don’t take the time to do it often. I look forward to trying new experiences and believe with the right person anything can be enjoyable."
229,CoppertopChica,F,Associates Degree,Caucasian,"I'm a single mom of 3 kids ages 14, 16 and 18. They have busy schedules and are a priority for me. I love doing things with my kids. We have fun and have a lot of laughs together. I say the “do not want children” for the reason of I will not have any more of my own. But I would gladly date a dad with kids. I'm attracted to intellectual and active men. I always gravitate to high energy. I like a man that can pull me into his conversation and make me laugh. I like an affectionate man, a social man. One that can hold his own in a crowd. I’m very independent, kind of a free bird spirit. But I like structured OCD kind of guy too. I’m not so narrow in my scope of what I like to rule out certain qualities except things like smoking. If you smoke just say so and let us move on. I won’t get used to it or ever like it. The biggest things is meeting someone and giving it a chance. In person and seeing our chemistry click is all we need to get things going."
230,llv19,F,Some college,Hispanic,"Hi! Thank you for checking out my profile. As this is very overwhelming for me, trying to stay positive. The app shows “I’m popular”... hmmm not sure how I should take that, but again, trying to stay positive. It’s just an online datin app... right?!?If I don’t respond to your message, pls do not continue to message me. I’m not here to waste my time or yours. I’m a very strong minded woman who knows what she wants. So...I’m very selective with who I respond to. I’m definitely NOT interested in anyone married ( yes, I see some on here who are married), separated, or in a relationship. I PREFER Local only, of course there’s always exceptions to the rules ;). I live a very quiet, simple, drama free life and would like to keep it that way. I don’t care to waste my time with anyone who brings negative to my life. Life is short and no time for negative vibes. I would love to find a MATURE man who is stable. One who is done w the games and wants to be in a healthy relationship. A man who believes in honesty and knows how to carry himself as a mature, honest man. Someone that I don’t hv to “babysit”. I don’t “need” a man, I “want” one. So treat me good and I’ll treat you better. A strong minded man who does not allow his past to mold who he is today. I’m a positive, outgoing girl who enjoys laughing, having a good time and being around good company. Life is good. I love my job, I have a great family, I’m just looking to connect with my missing link... my significant other. Successful, sexy, and smart..where oh where are YA?!?Someone ACTIVE. does something other than hang out on POF in front of the TV with drink in his hand ;)"
231,MaureenGlenn,F,Some college,Caucasian,"I like to laugh and have fun. I can be serious when I need to be, but feel that life is too short to not embrace joy whenever possible. I am very outgoing and honest. If you are looking for a one night stand, or someone to take care of you without being willing to care for her, then I am not a good match for you. If you are looking for someone to develop a friendship with, spend time with, and see what develops, then I just might be that girl.So, here goes ... One of the things that is bothersome about this web site is the men who pretend to be somebody they are not ... generally they live in some 3rd world country and are trying to scam innocent, naive, desperate women ... I am none of these. Other fellas just seem to want to text forever before speaking and/or meeting. Remember the old days, when you just met for a first date without all the ""crap"" first? Let's meet, soon, and cut out the text/message, etc.?I love going out and trying new things – but also enjoy those quiet nights at home in front of a movie."
232,txJen,F,Some college,Caucasian,Looking for a real connection. If you can make me laugh that’s a plus
233,lovinglife83c,F,High school,Black,"Like i said I'm me I'm a parent and I'm a hard worker, I go to church I like to have fun"
234,Mommadro420,F,High school,Hispanic,"Find that person who doesn’t only see you for your outer looks, but instead they see your true inner beauty. They understand you and accept you for who you are. They don’t require you to change yourself to meet their expectations. They devote themselves to you and you alone. If your ever having a bad day they will do everything they can to cheer you up. If you have been hurt in the past, they will be your bandage and make sure you heal fully. Should you feel sad, depressed or lonely, they will comfort you. They will be the type of person that loves you no matter what. They won’t judge you or harm you. They will stand by you till the end and make you feel special and important. You won’t feel alone or unwanted when with them. You will feel accepted and valued. They will tell you everything with honesty. This person will never give up on you. Because if they truly love you and they don’t wish to lose you, then they will do everything they can to keep you. If they are someone you are with, don’t let them go no matter what. They might be the only one you have ever known. Don’t give up hope! Stay strong. You will find them and you will be successful!!"
235,chronicbird,F,Some college,Black,"I'm looking for that special someone that makes me smile for no reason by just being in his presence who is caring with a good heart trustworthy and open minded.Someone who likes to have fun has a good sense of humor no games or drama looking for my bestfriend.  I'm a humble,caring,down to earth and open minded woman. I'm easy to get along with. I just want to enjoy life drama free with that special someone. I can't see meet me. You will have to message me. Good luck everyone"
236,CMEREDAMNIT,F,Some college,Caucasian,"FYI ?? IF YOU BLOCK ME YOU CANT MESSAGE ME! IF YOU SEEK SOMEONE REAL AND AMAZING, SHOOT ME A MESSAGE, IF NOT, SWIPE RIGHT! “BE CAREFUL WHAT YOU TOLERATE, IT TEACHES PEOPLE HOW TO TREAT YOU!” SERIOUSLY, LETS JUST HAVE AN ADULT BEVERAGE AND TALK, WHAT YA GOT TO LOSE! ROBIN ;)IF WE MEET AND YOU DON’T LOOK LIKE YOUR PIC, YOU HAFTA BUY THE DRINKS UNTIL YOU DO! ??IF AFTER SEVERAL DRINKS YOU DON’T ?? I GET TO PUNCH YOU IN YOUR FACE! ??"
237,Mari78230,F,Bachelors Degree,Hispanic,"Thanks for stopping to view my page. I'm here to meet new people in the hopes of finding someone. I'm a laid back person that loves to laugh and enjoy life. LOL nooo, I'm not Asian, Malaysian, Filipina etc.... just fluffyIf you'd like to know more.. I'd love to hear from you!"
238,aries_84_69,F,Some college,Caucasian,Just ask
239,drea96,F,Some college,Hispanic,"Seeking my best friend/future life partner. Figured I'd give this a try, can never have to many friends. I'm pretty independent by no means am I needy! Also not looking for casual encounters, that's dirty and I have respect for myself. Laughing is one of my favorite exercises. Mom to a teen boy, never married. Self sufficient, clean, have my own place/car. Also easy going, sarcastic, competitive and sweet. I’ve been told I’m a great story teller.Second note...I like the outdoors. I'm a bit adventurous when it comes to water fun. Love the beach!! Football is my favorite sport to watch. Love dancing salsa is my fave but don't be surprised if I bust out in the robot! Family is important to me. He loves sharing his knowledge of sports with other kids. I have a big tight knit family. I'm pretty low key don't enjoy drama. I can enjoy a cold beer but appreciate a nice glass of wine. Anything else your curious about fill free to ask."
240,AngelbabyinSA,F,Bachelors Degree,Caucasian,"I am searching for my soulmate, I have been patient. Please be kind and compassionate, affectionate and loving, loyal and trustworthy. I hope to find someone that will dance with me in the kitchen while cooking together.I am looking for that special man that will take me fishing and enjoy our time together having fun!!! Let''s start our journey together..."
241,livelylynn,F,Some college,Caucasian,Ask and I shall tell.
242,nikki0326,F,Some college,Black,Looking for a handsome gentleman to sweep me off my feet.... if that’s you send me a message :-)
243,m14mel,F,Bachelors Degree,Caucasian,Just looking...
244,biggurl78660,F,Some college,Black,Dont waste my time and i wont waste yours...... I want someone who actually wanna meet no games no sex talk.
245,Ing512Thehills,F,Some college,Hispanic,Live for me and I will die for you!! Humor is the key for me!! I love to laugh! I love everything about life. Feel free to message me.Im outgoing and very lovable.Im seeking a new adventure.xoxoxooxoxoxoxooxooxooxooxoxooxoxooxooxoxooxxooxoxooxoxoxoxoxoxoxoxooox
246,tam919,F,Associates Degree,Caucasian,Want to find someone to have fun and do new things with. Love to travel and explore places that I have never been before.
247,Bellablonde1,F,Some college,Caucasian,"No likes..message only..Please read the following as it may save you some time: So VERY tired of men that play games, use words for bait, thinking that will reel me in. I have ZERO time in my life for players, nor do I care to have my time wasted..... As time is a precious commodity!There is a name for women who are confident, sexy, like an occasional beer or glass of wine.. playing pool, taking day trips, enjoy spontaneity...camping out under the stars & taking long rides on the Harley or live music venues & dancing......KEEPERS!I have a lust for all good things in this world; good friends, good food, good adventures and good laughter. I believe in living life to the fullest and making each day count! Family and friends are very important to me.I love beautiful things, living in the moment and I am always dreaming bigger!I am a very passionate person & looking for the same in a man. I love music & dancing (must say I love 2-stepping to a good country tune), traveling, exercise, and designing are a few of my passions.I love to dress up and go out for the evening, but also enjoy staying home, cuddling on the couch while watching a great movie....(any suggestions )..?I am spontaneous, social, caring and adorable!Are you the one for me ? *PLEASE!!!.... do not message me if you are full of phony lines, lines of B.S., or just full of yourself..*Ciao!"
248,BBW43,F,High school,Black,There is not much to say about myself. I am a BBW that loves her body and I am looking for a good friend someone to hang out with me.
249,brnsugagrl,F,High school,Mixed Race,I am a Single mother of 3 beautiful grown kids who happen to be the loves of my life.. I am a laid back strong Woman with old skool values..A passionate humbling heart is one of my many assets?? My last cHild just left the nest and life Is officially about me and I'm ready to see what it has to offer (:. I don't care for quick hook ups cause quite frankly I can get that same satisfaction alone.. Im a woman who truly believes in Love and Loyalty.. A God fearing Woman I am!!! I'd like to add one very important note..My children are all young adults and am positive that I will not have any more. So if your wanting children you'd probably waste precious time with me..AND If you have a WIFE..GIRLFRIEND.. ANY EMOTIONAL ATTACHMENTS WITH A SPECIAL SOMEONE.. A BOO THANG...PLEASE DO NOT LEAVE ME ANY MESSAGES..Keep it moving right along..Thank You!! *** Profiles with Pics ONLY***
250,lovlit,F,Some college,Black,"I have tried this before and met some really great people . Just not the one for me (yet) lol. Im looking for some one who is ok with staying in or going out . I like old school music R N B, soft rock, 80s ....sorry lol showing my age. I treat people the way I want to be treated . I would like to think I'm a nice person . I know Im funny ,sweet , an loving . I'm hopeing to to find the same in a man ."
251,msjasper69,F,High school,Black,I can be shy when we first meet
252,1PrettyFeetChef1,F,Bachelors Degree,Caucasian,"BBW ... Entrepreneur, Independent, intense, loving and funny... Looking for a strong, honest, affectionate, funny man who can communicate... I'm a homebody but love to travel too...I would love to meet my king...I have so much love to give ,so much affection...I want to grow with you ...build with you , be partners... I very much enjoy the company of black gentlemen... "
253,airymood,F,Graduate Degree,Black,"I love adventure, fun, travel and the outdoors. I enjoy music and visiting clubs and outdoor festivals. I love to visit spas. Jazz is my favorite type of music. It is so relaxing and helps to de-stress me. I enjoy hanging out with family and friends.BETTER TO SEND A MESSAGE, RATHER THAN a want to MEET NOTIFICATION"
254,Wellhellothere27,F,Bachelors Degree,Black,I enjoy learning and growing. Being sound minded is very important to me. While watching one of my favorite shows I heard the judge say in a relationship you want to be with a person who can accept your type weird and not be bugged out by that.(We are all weird in some way) That sound like good advice.
255,DelilahZz,F,Masters Degree,Black,"I'm a very energetic, outgoing, athletic, Sapiosexual who is very adventurous and loves outdoor activities. I'm open to entertaining the company of a man who is athletic/in shape (no extra lbs), loves travel partner (Passport in hand), is adventure and wants new experiences. At this stage of my life I'm not into games unless it's a scavenger hunt for fun. I'm light hearted and free spirited. I don't allow any complainers, drama or negative attitude dudes around me.What A Guy Must HaveHe must bring positive energy only, be between 40-50 and stand over 5'9"", love to work out, be healthy and be a man of substance who is not prone to cursing, vulgarity or drunkenness. I'm not really searching for anyone. I'm here to see what I can see and meet new people because I am new to the area. I am very career focused, driven and travel a lot. So a relationship doesn't fit into my focus right now. Although, I wouldn't mind having a travel companion from time to time. If you have 0 profile photos I'm not even interested in you. The same goes for old outdated photos. If you were in shape 10 years ago but now you aren't but you still posting old pictures I'm not interested. To me that shows you have secrets and you aren't the same as your photos. Every last one of my photos have been taken within the last 3 months. I work out and eat right....I'm not thirsty so I won't just fool with any ole dude. Plus I make my own money so I'm not looking to be taken care of either. I can stand on my own. I want a partner who's the same.Lastly I Do Not Do 'Hookups' nor do I sleep around so if that's what you looking for - Keep It Pushing. If any of what I said irritates you - You Aren't The One For Me. See simple and easy. Not willing to settle for just ""any old dude"" ever again. Looking for above average type of man who's on my level.____I get asked ""Why Are You Singe"" all of the time. It's easy to answer. I KNOW MY WORTH AND I'M NOT SETTLING FOR JUST ANY DUDE JUST TO SAY I HAVE A MAN. I'm Fabulous Single until the right one comes along. I have too much going for me to waste my time with just anybody."
256,lunahermosa,F,Bachelors Degree,Hispanic,"Colombian living in USA for about 20 years, Bilingual Spanish and English, very out going and very sensitive person, animal lover, love to dance and go out, I like a men who knows what he want, I would like have a good listener as a friend I love to have a good conversation, with an interesting men. I would like to go slowly but surely in my relashionship."
257,pinkstar813,F,High school,Caucasian,I am a fun person to be around. Im a happy gal looking for a companion. I dont want anything serious finalizing a divorce. Looking for the right guy that I can have fun with. If you are the right guy please reach out to me and lets see where it goes. Im not looking for a one nighter but im still looking to have fun with the right one or later down the road. Im not the girl next door who does anybody and everybody. Im a real person with feelings. Im not a tart you can squeeze and throw away. Im one of a kind and if you think you can handle this lil gal and want to get to know me give me a shout. I am not paying for this profile so message me. Thanks for reading. 
258,TXVampy,F,Associates Degree,Hispanic,"Music is life. The rest is just details...Singer, baby bass player, gamer chick.Marvel, horror movies, roller coastersBlackberry vodka, sushi & plum wineFibro warriorMust love dogsI like guns...but not hunting. So, if u have a deer head or other animal carcass in your pics...sorry...hard pass."
259,bellaissma,F,Some college,Hispanic,"I am outgoing but still can be at home on a weekend and enjoy it. I Like traveling,being with family and friends. I am looking for someone that knows what they want and goes for it, looking for my best friend and a long term serious relationship."
260,winkatmesexy77,F,High school,Hispanic,"I’m looking for something serious and not looking to get my heart hurt again. Someone who could be my partner in crime. Someone who has a sense of humor. Someone who can accept the fact that I come with a package of three boys. Of course they’re all over the age of 18 but lookin for a person with a good heart to accept them. I’m not looking for a father replacement Bc they have they’re dad. I’m looking for someone who values a relationship. I’m not looking for one night stands or looking to play games. If all you like to do is think with your head downstairs and not up stairs then please don’t bother messaging me! I can easily get that at any moment, any time or anywheres without the help of this site. ;) Please don’t take this offense but if I haven’t message you back that’s Bc you may have not been my type and I’m not looking to waste our time. Now that’s over with....lolHere’s info about me. I love to go wherever the wind takes me. I like to hike trails, play pool (I’m not good at it but I’ll try lol), I like to Bbq, try new restaurants, go to the movies or watch them at home, I like to travel, be near the water, I like to social drink out as a couple or visit with friends and family, I like to be play and have a sense of humor, I love to cuddle and give lots of kisses, I’m easy to get along with and I can get a sense of your humor, I like to go site seeing or shopping around....pretty much, I’m game for anything. :) P.S. If your intentions are not the same like mines then please don’t message me. Thanks!"
261,tyty1219,F,Some college,Hispanic,Im a single mom which keeps me pretty busy. Looking for someone i can go out with and get out of the house when I'm not busy with kiddos games and practices. Looking to see what's out there.
262,MyBaby49,F,High school,Hispanic,"I’m fun to be with I would like to grow old with a good talk handsome man and I do date out of my race(black men) I have 3 grown kids and all on their own, I work here in Austin and I would like to meet someone here around my area, I’m looking for someone that’s serious looking for a relationship, We are to old for games, don’t waste my time"
263,Juatlooking,F,Some University,Hispanic,Will fill out later
264,smiley7919,F,Some college,Hispanic,Well get there when we chat.
265,txgurlinm,F,Associates Degree,Caucasian,I will keep it simple single women not looking for games. I just purchased my first home. Very laid back work retail so hours and days off change weekly. Have a great dog named Winston. If you'd like to know more let me know.
266,StormyVick,F,Some college,Black,"I DONT HAVE A PAID ACCOUNT SO I CANT RESPOND TO MEET ME!!! God is the source of my strength and without Him, I am NOTHING!!! I love to watch football ...yes I’m a Cowboys fan lol,....I love to play dominoes, fish and travel. I prefer to have a family gathering instead of clubbing."
267,GeminiSAgal,F,Some college,Mixed Race,"Love to travel, beach, flea markets and antiques. Family time, and spending time with grandchildren. Love to go to casinos! Enjoy the outdoors as much as possible! Love to dance!! ****Only interested in meeting someone in my area, no long distance relationship, Not interestedl in relocating or expecting anyone to move here. If you don’t have a profile picture don’t contact me. I prefer a gentleman to be over 5’ 8. And you must have the face I want to wake up to in the morning! Thanks"
268,2705alicia,F,Bachelors Degree,Hispanic,I am too lazy to fill all the questions.....????
269,Jessi72,F,Bachelors Degree,Caucasian,"I love to garden and enjoy being outdoors. I am into photography and work on perfecting that every day. I read and listen to all kinds of music. I like hikes and long walks, just being outdoors! I am a normal, single lady just looking for someone to spend time with and share a life with. Pretty simple, not looking for complications, drama or hook ups. I just want someone who loves me for me and go from there. Be kind, zero drama, happy and have your s&it together....what more could a girl ask for? "
270,Sissyre12,F,Associates Degree,Caucasian,Will fill out later.
271,missamyv,F,Associates Degree,Hispanic,"Love Addict needing rehab!After reading my very simple profile, please ensure our interests are in line. ESPECIALLY the “what you’re looking for” section. Time wasted never returns! Also, I often gravitate to individuals on the tall side. I’m 5’6 and want someone I can look up to! In more ways than one!!!"
