,username,Gender,Education,Ethnicity,about_me_text
481,TXLady65,F,Some University,Caucasian,"**Austin Area Men Only**I am a secure happy lady. No Games, Drama or Trauma. No Rescue needed.My kids are grown. I enjoy my job.Time, good conversation & touch are my love languages.  My goal is regular time together, home and out but I also enjoy my separate time. I am self sufficient and happy and seek the same.I appreciate a southern gentleman with manners who hasn’t forgotten the art and value of old school dating and romance. I like confidence, not arrogance. My special someone is a kind man, future grandpa material, not jaded, doesn't turn every discussion into a debate and is able to allow others to have their own opinions about politics and religion. Must understand the difference between affection and clingy and the difference between sexual and sensual. Must be available to date some weeknights and on the weekends.I am a lady, not a lay. If you just want sex please skip me. If you want a mama, skip. Once monogamous I do enjoy sex several times a week if schedules permit. If you have no sex drive skip me. That being said, understand i will not just be slipping into your bed. I want to know you and like you which requires dating. If I am not drawn to you as a person I will not desire you sexually. Appeal to my humor and intellect. I do not send nude pics or explicit details. Please don't ask or send.My profile pretty much spells it out. Looking for that one monogamous relationship that combines romantic dates, time in everyday life, emotional attachments and hot sex. I don't need to marry again but I've learned to never say never. I like my alone time so can feel smothered by someone who latches on to me as an instant life. I have been told that's just because it's not the right man. That when the right one comes along we will feel inseparable and not smothered or tethered. We've all had our own journeys at this point and feel we know what we want next, but the truth is that if that ""just right fit"" fell into our laps all preconceived rules and plans would fly out the window because we couldn't have possibly anticipated such joy and ease. So here I am trolling the pond, again. LOLInitial messaging here is fine for pre-screening and initial chatting but I prefer to meet in person to see if whit, humor, conversation and chemistry click. There's so much lost in messaging. We are humans not computers and really need the voice tone, body language, laughter, scents, and eye contact to get the full connection. I do not give my cell or email out til we meet. No Drunks, OneNightStands or FWB"
482,sin_poppin81,F,Bachelors Degree,Hispanic,"Message me if you are wanting a photo. Simply, don’t want everyone in my business. Believe 3 messages have to be exchanged in order to send pix. Don’t ask if I feel like being playful or send sexy pix! I’m funny as hell, love sarcasm, embrace change and adventure. Hard working person who is direct and achieves for greater and better things in life. I don’t like to settle."
483,RED78752,F,Masters Degree,Black,"""I'm just a girl, looking for a guy, in search of love ~ Sex and the City: Carrie BradshawSo at this point I am only on this site waiting for the right person to find me for companionship, great conversation, movies, traveling, shopping, sightseeing, or just doing nothing but sitting on the couch with a glass of wine and a movie.. Ethnicity is not a barrier... I am very driven, I work hard and have many goals and dreams to accomplish. I am not a procrastinator. When I am ready to go for something, I go for it. This is good and bad. I am often taking on more than most can chew, but I chew it and keep it moving nonetheless. I am very into politics and fighting against social injustice. On paper I am a democrat/liberal however I am more centered. I don't care what party you are, and you can support who you support, however if you live in the Trump bubble and ignore his lack of decency.....morals..... a brain (lol) and pretend like what is happening is not really happening then we will not be a good match. I don't debate, I can have a discussion on realistic things but playing ignorance to reality is not toleratedWhat qualities am I looking for in a man..... Hmmm.... Someone who has an understanding of the 5 Love Languages. If you don't know what that is google it. Someone who knows what their love language is and can communicate it, however, and equally important, a man willing to learn her love language and caters to it. Someone who communicates by listening for discernment and understanding, not a comeback. This is very important..... Someone who does without having being told to do. Someone who is patient, understanding, and can bring a sense of calm to my maddening world..... The art of courtship has been lost and I am patient enough to wait until I find it or it finds me. My time is valuable. Literally every second of my days are accounted for so definitely someone who appreciates and respects my time.So basically, “The most exciting, challenging and significant relationship of all is the one you have with yourself. And if you can find someone to love the you that you love, well, that's just fabulous.”P.S. I do not give out my number on this site. If you ask you are likely to not get a response, I prefer to meet in person after a few chats on here. Most men don't like this method to my madness and that is cool with me.... the right man won't mind (wink). Happy Fishing!"
484,GreenEyedMom50,F,Some college,Mixed Race,"Progressive Native Austinite (born & raised) who lives in SW Austin. I am short, curvy and freckled.. not the skinny barbie type. I am physically active and do care about my health.. you should too. I eat healthy most of the time but I do not deprive myself either. I love the lake but require sunblock and shade. Pet allergy.. so no fur babies, unless you are a neat freak.I am NOT interested in anyone who is conservative, middle-of-the-road, apolitical, or a Trump supporter! I am ONLY interested in someone who is Progressive politically and actually VOTES ProChoice! Yes, I am going to ask who you voted for and why. At least I am upfront and honest.I do get messages frequently from disrespectful creeps.. I'm telling you now.. you will be reported for harassment and blocked. Honestly, it amazes me that some people wonder why they're single!I do not give out my phone number or email to strangers. If you want to get to know each other, it will be IN PERSON over coffee or something. Please don't bother if you live elsewhere (20+ miles away is too far) or you're ""too busy"" to meet. I am not here to collect chat buddies and I don't like people wasting my time. I work 2 jobs, have four adult children, and I have a busy life that I enjoy. Please just be upfront and honest!I am aware that my profile seems a bit negative and restrictive. I am picky because I would rather remain single than get involved with someone who doesn't respect me in every way. I have NO RESPECT for racists, homophobics, DOMs, cheaters, or liars!! Please don't waste my time and I won't waste yours. Best of luck to you."
485,TXTruLady,F,Masters Degree,Hispanic,"Looking for LTR but not willing to settle. Love the outdoors and being active. I want a man who only needs and wants 1 woman in his life. Prefer a man who works business hours and off weekends. No hookups!I like hikes, 5ks, tubing, festivals, sporting events, playing pool ... mostly anything. I’ll try anything at least once.Only non smokers who live in SA n not travel for work.5’2 few extra lbsNot 420 friendlyMust love God!"
486,harmless68,F,High school,Black,I'm hoping to find friendship with a mature gentleman.
487,myrnajones,F,Some college,Mixed Race,I am looking for a man that knows what Integrity is. That''s honest upfront no secrets someone that knows how to communicate and willing to talk about anything I''m looking for that best friend that long-term relationship a man that is sensitive kind understanding if you are a ham hit me up if not pass me by
488,512martinez,F,High school,Hispanic,If you want to know just ask.
489,Believedj,F,High school,Asian,Ask me
490,jenniluv15,F,High school,Hispanic,Love Fam and spendin time with kids
491,Ebony_Eyes,F,Some college,Black,"A bit of a comedian, but with a great sense of humor, I love to have fun, live life to the fullest, why not. I love to cook,(I just need someone to cook for). Music is my medicine, so love to listen to all genres.. I am a work-a-holic, but will make time for the right person. When I’m not at work you can find hitting the highway out of town somewhere or just cruising to the country to see my people. Oh oh oh I like to play dominoes and cards! I’m a shoe person so I like to shop..(??). In my free time free time you can catch me wrapped up in a blanket on my couch watching movies and sipping my wine (moscato de’asti). THIS is me in a nutshell. However no doubt there’s more to me then this little box. Want to know more? Ask. P. S.Gentlemen I don’t need a man in my bed, I need a man that’s in my head that can Challenge my mind and feed my soul..Licked by the flames of knowledge..."
492,txmedic77,F,Associates Degree,Caucasian,What do you want to know?? Just ask....
493,GayleHills,F,Bachelors Degree,Caucasian,Up for new adventures and getting to know new friends. 
494,monaliza79,F,Graduate Degree,Hispanic,"Hey there. I’m looking for that special someone to love me the same way I will do to you. One of my goals in life is to get my own taco stand or a small restaurant. If you have any questions please ask. I am not interested in little kids, and so called men. I need a man who takes care of himself. I’m not interested in having sex so stop asking me. If you can’t pay for me on our first date then don’t message me either."
495,LadyCoach47,F,Bachelors Degree,Hispanic,"First let’s start off with I embrace God, my family , friends. Being an educator and a coach 26 years is rewarding and challenging!! Spend a great amount of time working so I enjoy meeting people to have a drink , dinner, great conversation!! Must love football ! Lol I love all sports it’s in my DNA!! Lol Love a man that can handle his own!! Kindness and Respect is everything! Having a sense of humor in this crazy world ! "
496,mesr06128,F,Associates Degree,Caucasian,"No pics, no response. I will not provide any personal contact information until after meeting in person in public. Doesn't anyone want a lady anymore. I am basically over the bar thing but do enjoy a happy hour or a group meeting at a bar. I have recently left a long term position with law enforcement. I truly respect those that serve and protect anyone who stands up for the right thing. I really enjoy puttering around with the yard. There is not much better than a beer after mowing the yard. Funny, I don't sit back and drink a beer after I vacuum and think - WOW, that looks nice. It just feels wonderful to be outside (when it is not 100 +). With that being said, I really enjoy going to the lake. The sound of the lake water hitting the bank is very relaxing. I do most of my workouts near the lake just for the sun / air / sounds. I can listen to most music (not rap or banging) but I mostly enjoy country music. I have not traveled much in my life but would love to now that I have more time. There are so many wonderful things that just need to be seen in person. I grew up going camping at the lake. I really miss that - not on the ground with snakes and such.If you are 5'5"" stop saying that you are 5'7"" or more. I am well aware that I am a middle aged over weight woman but I have provided accurate pics. Why be dishonest? If we are going to meet, we should be able to recognize each other from what we post.I am NOT looking for a booty call. If you are, good luck to you but do NOT contact me. "
497,nlnehring,F,Bachelors Degree,Caucasian,"Original Austin girl. Love live concerts, camping, fishing (I come with my own pink tackle box and ugly stick) , Port A, going out OR staying in. I love to cook (pretty good at it) and I hate to shop..for ANYTHING! Love Friday night lights! Love a good margarita or a cold beer! I am a die hard Longhorn fan and I do not miss games...for ANYTHING!. I''m easy going, honest to a fault, and have been told I''m pretty funny and have no filter. Have the worst potty mouth ever- but I'm working on it! . Looking for the same....or at least for the glass slipper to fit! If ya dont like my dog, or my dog dont like you-deal breaker. P.s. if you absolutely feel the need to send me a naked selfie in a dirty bathroom mirror- please swipe left...shirtless is okay- but you better be on beach or poolside. ALso, if your profile states that you are a widower, English is your second language, you are in the military but ""retiring soon "", (those three things together) and you need Itune cards...dont waste my time. Also, if you say you are in Austin then start a conversation with ""I'm actually out of the country on a ""peace keeping"" mission"" in Syria- move on)..Disclaimer: please note that these are only for scammers and they know what I'm talking about. XoxoxoxoNancyP.s.s there is ZERO way that every man on pof is a widower. Read my profile before you contact me. I'm a pretty darn good scammer detective!"
498,sunniatx,F,Associates Degree,Caucasian,"I have been told that my name fits me along with my smile, and I believe that to be true. I love smiling and I am a very happy person. I like to drive fast, love to listen to music, loudly in my car, road trips, I am ticklish, I like cheese and chocolate, but not together, I enjoy kissing, a lot, and I have three small tattoos. I love to dance, and have my boots ready if you two step, but will dance to anything. There's a lot more too!My friends will tell you that I am fiercely loyal, very kind and compassionate. I am an honest person, very caring and loving and will give the right person every bit of myself. I am searching for a friend, then a lover, and then my partner in this thing we call life."
499,CALXTEX,F,High school,Caucasian,"Yeah age is really just a number. But I'm not intrested in anyone older than me.Would like to meet a nice man. That wants to enjoy life having fun. The word is WE (not you , not me) WE !!! can have fun together..! With out all the pressure that some people put on each other.! Life is getting shorter for all of us everyday. So let's get to know each other and have fun and take things from there.! "
500,GinaC2323,F,Some University,Hispanic,"I've lived in the San Antonio area since 2010 and have lived in New Braunfels since September 2015. I am looking to move back to SA soon and am currently in Converse while I Search for a place in SA. I'm not sure which area of San Antonio I want to settle in. I'm in sales management with a focus on interior design.  Returning to school is one of my goals. My other goal is to lose 45 lbs. I'm a thicker woman but am looking to trim down and be as fit as I was in my 20s and 30s. I am NOT skinny at this time and will never be skinny again lol I'm looking to be a size 10 and am currently a size 14/16. I want a toned, yet womanly and thick body. Healthy eating and exercising are focuses for me and I hope to find someone that would like to join me on this journey. I like going to the gym often and spending time there. I'm motivated to transform myself back into the way I was :-) I'm not looking to sacrifice gym time for anyone... It would be nice to have someone that likes it just as much.. Dancing and Zumba are two of my favorite pastimes. Music is a big love of mine. Some of my favorite genres are rock, pop, Reggaeton, bachata, Spanish rock, rap, and r&b. I'm interested in country and some jazz. I love live music and going to concerts is favorite pastime. Comedy shows are a must and I love watching movies. Cooking together is something I love to do as well :-)I support all Texas teams but my team will always be the Dallas Cowboys.  I got my passport in November because I want to truly start seeing the world :-)The latter part of 2017 and 2018 were very rough and challenging years...I'm very excited to start 2019 differently and to definitely make this the year of change. I'm very optimistic that I will achieve many of my goals and maintain my resolutions. I'm not perfect but I do try to be the best person I can. I have a strong work ethic and am ambitious. I'm responsible, committed, nurturing, faithful, very affectionate, very passionate, sweet, kind, soft spoken, and empathetic. I can be a fire cracker at times lol However, I'm not mean spirited and I don't like to hurt people. I truly believe in treating people how you want to be treated. I am a romantic spirit and am looking for someone that is just as romantic and passionate. I'm not interested in a relationship that becomes stagnant and complacent. A successful relationship for me requires strong communication and both people that love intimacy with each other. We should do what we can to keep the spark alive and the relationship fresh :-) I'm looking for someone SINGLE that is interested in friendship to start with a possibility of it turning into a long term relationship. I'm not looking for a relationship immediately. It takes time to get to know someone and click. Dating helps you see if there is potential for more. Please be affectionate, fun, loving, sweet, passionate, sexual, sensitive, honest, faithful, kind, open minded, and able to communicate. I'm interested in someone who is verbal and can carry on conversations on the phone and in person EVENTUALLY. Texting should not be the ONLY way to communicate please :-) Please love to smile and laugh."
501,NurseProf2,F,Masters Degree,Caucasian,"My favorite - YOUR SMILE !! VERY New to San Antonio - moved here weekend of October 11-13,.spent last year in Sweetwater Tx - eeeewwwe.OMG - so glad out of there. Figured out how to get to Costco, Walmart, and work. Need help navigating this huge city..Cannot see ""Meet Me"" - say hello instead, or add me as a friend. - if you really want me to know who is 'knocking"" - smiles; send me a message “ I am not an extrovert, but not shy. Love to travel, keep passport current. *** BE honest from the start. it really is much easier than remembering what lies you have told to whom.** - I have confabulation-radar - lolMy name is not ""Sweetie"" or ""Hey Beautiful"" and NO - I will not divulge my cell # to you after one hello. Would really like to find a guy that is loving, considerate, can think as a couple and not an individual, who is honest and caring, : I give my all in a relationship, without drama, and ask the same in return. Hoping to find a guy that really wants to share his life. (But always leave time for self!) I am giving, and can love and trust with passion, enjoy laughing and learning, everyday. Always smiling, unfortunately the Bells palsy in 93 - left eye droops when I smile or am tired. .Not catchy - smiles Green Belt riding/walking path out my back door (50')Prefer a tall 5'11"" + , professionally educated ; working in his chosen field?. Tall- perfect for romantic dancing. Do you have time to nurture a relationship? Do you actually have time to take vacation? Do you like talking about your day @ the end? i.e.- sharing. It doesn't have to be a perfect date, but how about a soda in the park as we fly kites - plenty of time to talk and get to know each other. Looking for a monogamous, respectful, honest, with someone that wants to share growth and understanding, affection, hugs.. good food...to cook with.....to laugh with....be spontaneous with and to have...fun.. play.  Oh BTW - do not like fishing . But do not mind if that is what you do as ""guy time' - You clean it, I will cook it. - smiles. I have a high disregard for liars. ” Please be a nice guy...I cannot see when you hit "" MEET ME"" - but I can see when you hit favorite.....Am I really asking too much? I didn't think so"
502,mel43kj,F,Some college,Hispanic,"I like to workout, I''m ready to experience life with someone. My kids are grown, I want someone to have fun and experience the little things in this world. I like all kinds of music, laughing, dancing, good food, night out with family or friends. Staying in watching a good movie is relaxing too. I plan to travel, learn new thing and enjoy life when im not working. "
503,Julianatx,F,Some college,Mixed Race,"I have my a great life, home and job! I hope you do too!!!!!!. I you are the type of guy that copies and pastes messages, move along! Be creative when you send a message, make it fun and personalized. Only when you meet in person you know if there’s chemistry. My friends tell me I am a great catch and I do have very high standard for a partner!!!! I moved to Austin over a year ago and I would like to find someone to show me around town, have fun, laugh and see where it goes! I don’t want games! I’m here to be real!"
504,CowgirlDiana,F,Associates Degree,Caucasian,"I enjoy doing outdoor activities when the weather is nice. I also enjoy going to the movies, out to eat, candlelight dinners, snuggling, country and western dancing, along with dancing to music from the 80s and 90s. I’m very much a people person. I enjoy doing things with my friends, as well as spending quality time with my other significant. I am a very honest and Upfront Person. I consider myself a very affectionate person. I also like to travel and explore new places. I also like to go to concerts."
505,Elainel15,F,Associates Degree,Black,"I like dining out and going to movies,picnics and dancing from time to time."
506,ladybug830,F,Some college,Black,"Looking for someone who is serious about being in a real realtionship with a real woman im very independent all my kids are grown and dont live at home, looking for LTR someone i can spend and enjoy the second half of my life..no texting buddy or pen pals"
507,grpvngrl6,F,Associates Degree,Caucasian,"I am looking to meet someone and start dating and if something more happens then I am very open to that. I enjoy going to the movies, though I have not been in a while. Dancing is always a good time. My friends are important to me so I like to keep in touch and do things with them. I am open to learning new adventures. I am told by my friends that I am very outgoing and that I can always make them laugh, also that I am a happy person. I know that if you enjoy yourself and don't get upset at what you can't change and change what you can then you will be so much more happy with life. I enjoy a lot of different music, though it should be good for dancing."
508,cutefeetdenaH,F,Associates Degree,Caucasian,Let’s go to the restaurant and then we’ll go to the movie!
509,MonarchBF,F,Bachelors Degree,Caucasian,"I was born in New York State, but I've been in Texas for just about as long as NY now. Does that make me a Texan? I've lived in all the big Texas cities...Dallas, Houston, San Antonio and of course here in Austin. I've loved them all for their own unique and special things. I still walk fast and talk fast and I love the NY Yankees - I have the Bronx in my blood. If you mix in a strong love for the quirky things about Texas, the hill country, small towns, country music, boots and wildflowers...that’s me I guess. ""I've been to hell and Texas, I know what its like to be riding that hot streak, and drunk on some back street..."" Well not literally. But, you get the drift. I've had my ups and downs. But I’m self-sufficient, have a job, a dog, own a house. I listen to Tanya Tucker, Steve Earle, Bruce, Willie, Guy, The Dixie Chicks, The Clash, GaGa, Ella, Pearl Jam and everything in between and around. I dream of traveling - road trips, day trips, any old trip even a head trip. It's what makes my heart beat fast and my smile wider. I'm pretty active. I have an active gym membership...meaning I actually go regularly and do stuff! I do a High Intensity Cardio/Weight training class 3/4x a week and I usually find other stuff to do throughout the week. I like to try new stuff. Being active is important to me. I've had my share of injuries...concussions, broken ribs...I fall off my bikes but I still ride 'em, even vacation with them. I like to cook! More than that - I love food shopping- grocery stores-I love them. There is nothing better to me than planning a meal and shopping for it! What can I say? The first time I walked into Central Market was pure JOY for me. Food makes me very happy. That's enough of me. The last thing I'll say for now is that I'm progressive with my politics. I’m looking for you because you are funny and smart and kind. You are ready to dance through life with a partner and a friend. You are looking for your next adventure with someone because while you could do it alone, you would much rather be with someone who is challenging, open, interesting and packs light....that part’s me. Try me out and find out. "
510,1simplysweet1,F,Bachelors Degree,Hispanic,"I’m an introvert and definitely enjoy my quiet time, but I also like to get out and have fun. Festivals, live music, dancing, movies in the park are all things I greatly enjoy! I’m looking for a serious relationship. I do not have children, nor do I want any of my own. With that being said, I’m a preschool teacher and love my kiddos, so if you have children of your own that’s not a problem. :) I’m mature and responsible yet can be a big dork and very silly (my job requires it :P ). I’m a dog person (allergic to cats), kind, honest, selfless, and can cook! What else is there in life? :D"
