,username,Gender,Education,Ethnicity,about_me_text
0,ShortyFire1984,F,Bachelors Degree,Caucasian,..............................
1,ROXYCHIC549,F,Bachelors Degree,Caucasian,"'"" I am not an upgraded member. So if you want to meet me you must send me a message."" That's the bottom line......READ ON..... Lets laugh, play, and make memories. However I don't date by texting and emaling. I have had a TX, real estate broker's license for the last 35 years, and have bought sold and flipped a few houses in addition to selling for years. I am classy, yet casual. I love people. I have a very youthful attitude, and enjoy skiing, fishing, theatre, ATV riding, boating, and traveling. I love music, dancing, and the sound of ocean waves. I like fireplaces, lightening storms, waterfalls and fireworks. I have done a lot of fundraising and charity work, and feel the need to pay it forward. I'm a good cook and like to entertain. I have a great sense of humor, and love to laugh and play. I don't want to be around negative people. I refuse to grow old, and don't enjoy people who take life too seriously. I enjoy nice things, but I am not high maintenance. I'm not judgemental, jealous or possessive. Everyone needs some space. I want an educated, successful man in his own right, who can take my hand and lead me. Someone who is equally yoked with me, physically, educationally, emotionally, and financially stable. I want a Christian man, who will be my hero. All my pics are current, but I am older than listed. Please have yours current also, and leave out the 5 people around you. I won't know who you are in the line up. I live on the Central Coast of CA, but I spent half my life in TX, with all the Southern values. I'm genuine down to earth, and grounded. I am not married to CA. I believe happiness is where the heart is. I'm open to living anywhere wirh theright person."
2,tequilagirl69,F,Associates Degree,Caucasian,Laid back lovable fun leo looking for someone to belly laugh with. Looking for locals ONLY. Don't have time to train guys way younger. Sorry boys! Looking for something meaningful! 
3,atxredneckgirl,F,Some college,Caucasian,"Tx country music junkie.No sickos w nasty pics...I will report you...My race only please.No extreme facial hair.Clean cut and groomed.And no shorties.....No pics then you hiding something....Dont post pictures of what you used to look like.And I'm 49.If that's a prob , then buzz off."
4,mel12th,F,Bachelors Degree,Hispanic,I am here to look for people to converse with...nothing really serious just yet...conversations..not looking for sex..not looking for dirty pics.no pervs...just want to meet new ppl to hang out with...i like to go with the flow and like to do all sorts of things such as going to movies...find things to do in the city..stay home a listen to music and chill...etc.
5,Andi010274,F,Some college,Caucasian,Can't get into my account so I had to start over.
6,nodutch,F,Associates Degree,Black,Music business goals meditation affirmation a great quality of life
7,lauranmr,F,Some college,Caucasian,"Of all the dating profiles in all the world and you click onto mine... Play it again Sam, you know what I like... I love music~variety. Music tells stories, entertains, brings people together, so I enjoy it in almost all of its forms. I love the arts for the same reasons. The beautiful harmonies of nature fill me with awe. I believe we should be our authentic selves. Honest, quirky, easy going confident woman.Note-Thank you for taking a moment to read my profile. Please check my location. I am not looking for an online or long distance relationship or friendship. If you are not prepared to meet and get acquainted, please do not waste you time contacting me. I appreciate the interest, but that is just not what I’m looking for."
8,smbd75,F,Bachelors Degree,Other Ethnicity,"Likes: fun, adventure, exciting.Dislikes: boring, rude, narrow mindedness"
9,candipie1989,F,Associates Degree,Black,"Single black female, brown eyes and black hair, I am attractive ssbbw. I like live music and poetry and writing short stories. I am a mature woman who is seeking a genuinely nice and honest person to get to know and hang out with. I'm not interested in hookups but friendly companionship. Looking for someone who can except me for the sweetheart I am. Seeking someone to make me laugh."
10,tif1985,F,High school,Hispanic,"I'm on here just looking for friends someone that can hold a conversation and be fun. I am a single parent of a seven year old boy. I like to go out to bars, movies or even just stay hm with that special someone.I'm a very nice and caring person. I'm also not on here looking to hook up for a one night stand."
11,De1964,F,Bachelors Degree,Caucasian,"Please local only to Central Texas. Also while I appreciate your service to our military I am too old to have a relationship that has to worry about deployment or moves . I guess I can say I sometimes hit wrong button when looking at profiles on my phone. I also will say I will click on your picture if I see a pet. Or if I see a cowboy hat. Or if you have a great smile. Yes if you are shirtless and have a great body. Mmm so if you are in a hat, without a shirt and sporting a great smile well then I will just have to click on your profile. Chunky, upbeat and goofy. My son's friends think I am a cool mom. I think I am a good friend to have. I am trusting and try to surround myself with people who are worthy of my friendship.Work in downtown Austin.Love to country and western dance. I like playing pool (not that good) but am good for a laugh or two. Wish I owned a shuffle board table. I will play horseshoes until I have blisters. I have an almost 4 year old deaf boxer and a 7 month old****r spaniel. Love to cook. Comfort food and baked goods. I repay favors with chocolate chip cookies or a homemade cake."
12,Trini1971,F,Some college,Indian,"I am a Mom to a 15-year-old. I was born in the Caribbean I am West Indian.I am seeking friendship if it turns into more I will welcome it, I am not here for a one night stand or a hookup. I do not have the meet me feature so if you want to speak to me send me a message. I am inquisitive. I am from the land of sugar and spice and I can do everything twice (wink)I am easy to get along with. I can be feisty when it's needed. I got a sense of humor, doesn't need a****ail to have a good time. I like to read, cook, dance, listen to music hang out with my loved ones. Love going to concert."
13,FiaFia1213,F,Some college,Caucasian,"I like to think I am mostly just normal. I have two little boys that I share custody of. I enjoy good beer, good whiskey, intelligent conversation, and the comfort of a relationship. 95% of the time I'm busy being a single Momma. The other 5% I am trying to figure out exactly when it will be acceptable to take of my pants and find a corner to nap in."
14,SweetJojos,F,Some college,Hispanic,Up for anything
15,Tawdra83,F,Bachelors Degree,Hispanic,I’m a artist. I cook at my job and I do a lot of customer service relations as well. What makes me unique is that I am a hard worker and I love to make anything I do work out and taste wonderful :) I love 70s rock and alternative rock and other music. I’m not picky my playlist is very wide. If anyone wishes to meet me or just talk to me please message me. I’ll message back when I can. Can’t wait to hear from you guys out there. :)
16,LadyTexas254,F,Bachelors Degree,Black,not looking for anything serious at the moment just doing mekik me @ ash_nicole254 (ladies I braid hair)SMOKERS especially cigarette Smokers please bypass me altogether I'm NOT interested DO NOT ask for my # if I'm feeling you I'll offer it 
17,Vigilia79,F,Associates Degree,Hispanic,"Hi there! I'm Christina: I'm not perfect and never said I was! *Im 40 yrs old* 17+ yrs in kitchen management and decided to change it* About to graduate with AAS in network admin in Dec 2019*Will graduate with AAS in Cyber security in Mat 2020* I have 2 sons , 21 and 16. * INFJ Personality. ( no matter how many times I take test...it never changes. )* I''m looking for someone who can make me laugh. * I''m tall, weird and chunky so you must like that.* I like all kinds of music, concerts, road trips, being lazy, random adventures, dinner n drinks, BBQ, movies* I want to find someone that will want to do those things with me.My IG: vigilia79 :)"
18,ayoung292,F,Masters Degree,Caucasian,Music is life and concerts are my addiction. Could be addicted to worse things. Have all I need but love.
19,Foreverfungrl,F,Some college,Hispanic,Ask me Are
20,southstar5,F,Some college,Hispanic,Single have two kids don't want any more.
21,alpha3975,F,High school,Hispanic,Movies dinne out..
22,71NOexpectations,F,Associates Degree,Other Ethnicity,Just testing the waters here...NO expectations. My age is 48 not 43?!?!
23,LadytexanInSA,F,Some college,Hispanic,"Hi I am a single Hispanic divorced female...I am not Ms. America and certainly no skinny Barbie guess you could say I am a short BBW. Hey give me credit I use to weigh over 300 lbs now down to 250. I work hard and work alot... I want to change my life and want to find a partner to love me and me love him. Someone that is as attracted to me as I am to him. Although I am not the best dancer in the world I love to dance all types of music except the rap crap ""yuk"" I am a family oriented person and would welcome a wonderful man that is willing to share his life with me and me with him. I don't want drama.... all I want is a peaceful relationship full of love, one in which we compliment each other. I don't want someone that is an alcoholic, drug addict, womanizer or with no goals in life ...I don't need that in my life and I will not settle for it either. Sorry but have to make sure you understand that--also I believe that if there is no chemistry on the 1st date there is probably no reason to pursue the relationship. Also, if you have a Harley it does not impress me (seen too many spinal cord and brain injuries as a result of motorcycle accidents)so be safe. Good Luck to Everyone in finding their special someone.....God Bless"
24,Wishing_on_stars1,F,Some college,Hispanic,"Looking for the whole package. Someone who wants the long term. Outdoorsman who likes to fish, loves the beach, always up for travel or where ever the day/night may take us. Be willing to take me to that dive bar with the food truck outside or maybe just stay at home once in a while or hit up the movies. Must be family oriented, have manners and all the other normal things in life like a job,car, own place. Good music, cold beer, great conversation = good nightI don’t pay attention to the meet me notifications, why not just drop me a line?"
25,KarmaChris,F,Bachelors Degree,Hispanic,I know my worth and don’t need a man to tell me. I don’t want to be taken care of and I DO NOT want to take care of a man!
26,cat2018bf,F,Some college,Asian,I'm a mother of 4 awesome teenagers!! I've been on this site off and on for too long. I'm hoping to find a connection with that special someone. Is it you?
27,taty4242,F,Graduate Degree,Hispanic,"Have a great conversation, dinner, or lunch and don't forget to speak the truth because I hate when men’s lie and you can see the lies on his face . . . . Don't forget be your own not trying to be another person...Please..... Do not put your car, it seems that it is the only thing that you can offer, Very beautiful the case and of very little value the ?? jewel ??."
28,splatina,F,Some college,Hispanic,Number one reason why someone you contacted does not respond is because they are not attracted to you.. plain and simple.. and vice versa..we have a choice..people should get off the high horse they are riding..Single mom by choice..the fishing pond has very limited options and most of the time it’s you who puts the limits on yourself.. Time will show all your secrets.. why lie.. it’s gonna come out anyway.. just save yourself time and stop wasting others time.. so selfish and rude.If your looking for Ms perfect please leave this profile now.. she’s not here..if you have a vision in your head about what she looks like or how she HAS to be..she’s not here.. just saying
29,LoveMichi83,F,,Hispanic,"Hi, hope you are having an awesome and blessed day. My name is Michelle, thank you for your interest in reading my profile.... -> Looking for my best friend, in the hopes that one day, it will turn into marriage. Preferences: 5'10 or taller and age range 38-44 Raised in the USA: I am part French and part Mexican= Frenxican, LOLI was born in CD. Juarez Chihuahua Mexico (6yrs)Raised in El Paso TX (15years)Moved to Austin area to attend college and stayed We really like it here! (16years end of January) Important: What you are about to read, will keep the right men interested in me, and will keep the wrong guy away... I am not here for a ""free meal"" or anything like that. I am here looking for something serious. We learn from our experiences and become better individuals for our future. It's all about perspective and being positive! A little bit about myself: I am a single mother of three kids (from the same father). Their dad is in Houston visits them when he gets a chance. I keep myself busy with a full time job that I love, two part time jobs that only attend to about 2-6hrs a week, try to make time to hang out with my kids, and we are active at church. It really just depends what is going on. Please don't let all this discourage you from messaging me. I do make time to respond to texts on my breaks/lunch and will make time to hang out or go on a date with the man that really wants to be with me. I am a one man woman, and when I meet him and feel like he's The One, just then and only then, I will get off this site. First things first.... My best friend and true love must put God 1st.I am a devoted Christian woman, and I seek a man who is God centered and has a relationship with God. A God Centered Man: A true man of God is; trustworthy, honest, confident, respectful, serves others, fearless, compassionate, and loving. A true man of God is not; prideful, rude, sarcastic, disrespectful, mean, does not manipulate, nor will he hurt anyone in any way.My Walk as a devoted Christian woman: A little bit about why a relationship with God is important to me and my significant other needs to be a true faithful man of God....*I was born into a Christian family, however I never felt a relationship with God until now. My parents got divorced when I was a teenager and we stopped attending church, my mom lost faith. Later when I became an adult, I would attend church sometimes, read the Bible, and prayed. I believed that was enough.... but it wasn't.I went through sooo many things.... until one day I had nothing and had many many obstacles..... my mission leader told me one day, get on your knees and pray. I did and my life changed forever. God started answering my prayers, fast! I decided to get baptized at my current church, and be more involved serving others (teacher at church) and a student in bible studies. One day I asked God to use me in His favor.He annointed me with the Holy Spirit and sent me as a missionary to Mexico, and now I am also a prayer partner at church.**I still have lots to learn and do. I am not perfect. However, it is extremely important who we allow into our life, into our minds, and into our heart and soul. I learn from my mistakes, and make changes as I grow.Life is about changing, but changing for the better. A true relationship: I am here looking for my true love, a serious friendship that will turn into marriage, I am in no rush. To be friends 1st will allow us to get to know each other better; learning how to communicate with each other, develop trust, be honest, and respect each other's time. I am very confident about myself, I know exactly what I want and need. However, I am not perfect, but always improving. I have learned to be alone and not feel lonely.Relationships is something that we need to work on daily, showing respect, having communication, caring for each another, being honest, and being compassionate. What do you seek physically in a woman? Physically I call myself average. I am active-working out again. Walking, jogging, INSANITY (occasionally), and small weights. Body type is Not too big or small.I carry myself very well and I find myself attractive. My best attributes are my beautiful long wavy/curly hair, big brown eyes, nice lips, and long legs. Let's talk about LOVE: These are the 5 Love Languages: Words of Affirmation, Acts of Service, Receiving Gifts, Quality Time, and Physical Touch.This is how I feel about them: we all feel some are more important than the rest.... #1- Words of Affirmation (attention).Complementing each other Extremely Important. Makes you feel attracted to your significant other, more confident, and makes you feel positive and happy.It's really sad to feel lonely when you are next to someone who doesn't give you the attention nor do they talk to you. Sometimes it makes you feel that you are the only one doing it.... not good... starts making you doubt who you are with.#2- Quality Time When in a relationship, I believe it's important to do almost everything together. There's times that yes, we can enjoy being with friends without our significant other. As long as there is trust and communication.#3- Acts of Service I am a single mother of three kids, I don't have a man around. If there's anything to be done that might be more for a man to do, I'd like for the man in my life to step up and help. Or help others- super attractive #4- Receiving Gifts This is super important when starting a relationship. It makes each other feel special. This tells us that our significant other was thinking about us. #5- Physical Touch I seek a man I can call my best friend- which means I can trust in and won't judge me, but will know what to tell me. Be there for me when I need him the most. Someone I can be myself with and won't try to manipulate me to be someone I am not. Hugs and kisses are important in my culture- I am Mexican, hugs help in many ways: Helps release stress, feel loved, can take you from being mad to calm to down. Also, since I am obedient, Intimacy comes later in a relationship (marriage). We need all Five Love Languages in a Relationship.They are all important. If interested please don't be shy and send me a message.I seek my best friend; this creates trust, learn how to communicate, and to be honest with each other. The rest comes later, I am in no rush. Thank you for taking interest in reading my profile. Be safe and God bless "
30,aims2016,F,Some college,Hispanic,Hi my name is Aims not sexy .. also if you do drugs such as meth and coke please dont even bother .. not really sure what I am looking for ... if you start off the conversation with do you want to **** I will not entertain you at all I am much more than a piece of ass thank you
31,RoxannenicoleM,F,Graduate Degree,Hispanic,"Simply looking for a serious man that can be FAITHFUL.I am a simple easy going women that is in search of a loving, passionate and outgoing man. I am easy to please and simply want honesty. If your looking for just a good time please move on to the next. I am not about games but a long term partner. In hopes of something more when the time is right. I am a Christian women, mother and hard worker and expect no less from a man. I believe in order for a relationahip to work your heart must belong to the Lord first. And the rest will fall into place. So again if you are not looking for something serious please don't waste both of our time. -I believe that life is way too short for games and lies. I am old fashion a believe in taking care of my man when he gets home with hot home cooked meals and knowing the deference between family time, work mode and our bed room time. You can find me on Facebook if you want to know more about. Maria Diaz Rodriguez."
